{
  "api_version": "v1",
  "artifact_count": 28,
  "artifacts": [
    {
      "bytes": 3560,
      "name": "manifest",
      "path": "api/rapp-work/manifest.json",
      "sha256": "fd1615ee12d54fd511be2cf5b84a1fbff714fb27fd60d68862a0a7a7f5be3006"
    },
    {
      "bytes": 1103,
      "name": "artifact-snapshot",
      "path": "api/rapp-work/schemas/artifact-snapshot.schema.json",
      "sha256": "2be403797a5ad6ffb8cc612535b09b0742c39bab77c71e6abbb24855f4e7ccb3"
    },
    {
      "bytes": 9268,
      "name": "common",
      "path": "api/rapp-work/schemas/common.schema.json",
      "sha256": "9471e6e9a5a7cbd30dac6b3ea8541036a05b10c5dc6c06ff949b0c2f8cd2e60d"
    },
    {
      "bytes": 1987,
      "name": "discovery",
      "path": "api/rapp-work/schemas/discovery.schema.json",
      "sha256": "93bc5823ec7c564ef26d044a2bcea95a317101c282da1a81e2b8ed018f2c6cbc"
    },
    {
      "bytes": 1371,
      "name": "hashes",
      "path": "api/rapp-work/schemas/hashes.schema.json",
      "sha256": "eda16099b94390affd63cb3b845a36fb96e3d91835f75b7f2a5edef640c6ba7c"
    },
    {
      "bytes": 1273,
      "name": "index",
      "path": "api/rapp-work/schemas/index.schema.json",
      "sha256": "5926f2ed0a785060ebdbc53acfdb591129f956515aba6889ac6436755c59f76a"
    },
    {
      "bytes": 4712,
      "name": "manifest",
      "path": "api/rapp-work/schemas/manifest.schema.json",
      "sha256": "69f819fe8582e8f0c93944b21663042aeeda4699022553f24326bfe15ab8440a"
    },
    {
      "bytes": 1946,
      "name": "offline-seed",
      "path": "api/rapp-work/schemas/offline-seed.schema.json",
      "sha256": "f7b5ca0b5f2ecd7625158978675025aeafd7dbfe7f2b40b2ff1925caa00ad8ab"
    },
    {
      "bytes": 1008,
      "name": "plugins",
      "path": "api/rapp-work/schemas/plugins.schema.json",
      "sha256": "1915d5ce62fdabbf908c5bc238cc23ca66d401ad478fee135f06a546b2ef0306"
    },
    {
      "bytes": 2006,
      "name": "profile",
      "path": "api/rapp-work/schemas/profile.schema.json",
      "sha256": "217f9316b6d334a80876aa07ceb94d6fcf81cfff8cb6e43d633ec1480e193336"
    },
    {
      "bytes": 1253,
      "name": "receipt",
      "path": "api/rapp-work/schemas/receipt.schema.json",
      "sha256": "819832808e5a7357efe10619ea095a9b2bdc11ad1af7d85dc05128ee8d33c069"
    },
    {
      "bytes": 2074,
      "name": "receipts-index",
      "path": "api/rapp-work/schemas/receipts-index.schema.json",
      "sha256": "2e5be1704e18f0127068eb6011f96e753d244da340b97dd1399f4ef66db2e769"
    },
    {
      "bytes": 3524,
      "name": "releases",
      "path": "api/rapp-work/schemas/releases.schema.json",
      "sha256": "894f83ebb137b0e4d8046ee9138a28f1c7cdc7d348a911a9c5eceea466604971"
    },
    {
      "bytes": 2607,
      "name": "rollback",
      "path": "api/rapp-work/schemas/rollback.schema.json",
      "sha256": "8c6044a506e5982a47f5580814d26b695c9ba88479264d077b24066f8fd3e095"
    },
    {
      "bytes": 993,
      "name": "sdks",
      "path": "api/rapp-work/schemas/sdks.schema.json",
      "sha256": "297d9ccd713808b0046b6eff8f600bfe33220539b4f6f50ac05ec0fccc3627f2"
    },
    {
      "bytes": 1003,
      "name": "skills",
      "path": "api/rapp-work/schemas/skills.schema.json",
      "sha256": "b6f80e79a0d5738f4fc286666a9fa9c314ce3310958fc90da4ae08bf7d03880e"
    },
    {
      "bytes": 1503,
      "name": "status",
      "path": "api/rapp-work/schemas/status.schema.json",
      "sha256": "c437303496cf39fe29997f28942e90edc80fab01f6cd0ae962a9bd01104b77fb"
    },
    {
      "bytes": 8303,
      "name": "discovery",
      "path": "api/rapp-work/v1/discovery.json",
      "sha256": "b9c5a2bdabe8fbbbc9fe7f2bedc0fda0ab0fe07be4a504f4a7a9bc966ac50d30"
    },
    {
      "bytes": 5763,
      "name": "hashes",
      "path": "api/rapp-work/v1/hashes.json",
      "sha256": "e85b7afd182e4c931397425d9ba27ee07574faebb253c4d67034e76f77e304e1"
    },
    {
      "bytes": 7988,
      "name": "index",
      "path": "api/rapp-work/v1/index.json",
      "sha256": "c1957907d684fc19af47d9954a24bcc0216c83507fb67f0ee1b585978b412121"
    },
    {
      "bytes": 4836,
      "name": "offline-seed",
      "path": "api/rapp-work/v1/offline-seed.json",
      "sha256": "051a359a0b4aaf0d3f7912e29d322e0e4f0838933cf11b892c57a2bc4ef4a7ac"
    },
    {
      "bytes": 938,
      "name": "plugins",
      "path": "api/rapp-work/v1/plugins.json",
      "sha256": "27c7bb462ad1eff8837ace170e1cb13b0c99667de3291a29180b4f10699ee5f5"
    },
    {
      "bytes": 789,
      "name": "profile",
      "path": "api/rapp-work/v1/profile.json",
      "sha256": "b4c7fc7be19886c3a900512177d80ca622d1dd14028cfb9f350f7ca11499aa82"
    },
    {
      "bytes": 2952,
      "name": "releases",
      "path": "api/rapp-work/v1/releases.json",
      "sha256": "555169f2292b80d917f96fd5d2f61a6e512903a91488cf94369520076d225266"
    },
    {
      "bytes": 1580,
      "name": "rollback",
      "path": "api/rapp-work/v1/rollback.json",
      "sha256": "11f914f96f5582e58ae375f8f7a20831fd6561e12651e939ebc56b96b103cb77"
    },
    {
      "bytes": 901,
      "name": "sdks",
      "path": "api/rapp-work/v1/sdks.json",
      "sha256": "1e0db89a39c5ba61144fbe6acba2e5fea48ced19cd48901430976d1050501c2d"
    },
    {
      "bytes": 933,
      "name": "skills",
      "path": "api/rapp-work/v1/skills.json",
      "sha256": "9ddab471cf546ce915fbc58f508b41f973e0bc1a10fd0d5029d85cf2ba6f3f20"
    },
    {
      "bytes": 1837,
      "name": "status",
      "path": "api/rapp-work/v1/status.json",
      "sha256": "328793a2cdf747e1c071e37a9def2e4ad9ada975c64617d70429caf159e6e655"
    }
  ],
  "authority": {
    "authoritative": false,
    "protocol": "RAPP/1",
    "statement": "This generated static discovery surface is non-authoritative. Signed RAPP/1 frames and signed RAPP/1 registries remain the authority.",
    "verification_required": true
  },
  "binding": {
    "kind": "content-addressed-artifact-snapshot",
    "pages_url": "https://kody-w.github.io/rapp-static-apis/api/rapp-work/v1/receipts/artifacts/sha256/5ec867b802488ecb30d44d134b0dff714d51de29fa90936f6a8635cf524d90cd.json",
    "path": "api/rapp-work/v1/receipts/artifacts/sha256/5ec867b802488ecb30d44d134b0dff714d51de29fa90936f6a8635cf524d90cd.json",
    "raw_url": "https://raw.githubusercontent.com/kody-w/rapp-static-apis/main/api/rapp-work/v1/receipts/artifacts/sha256/5ec867b802488ecb30d44d134b0dff714d51de29fa90936f6a8635cf524d90cd.json",
    "sha256": "5ec867b802488ecb30d44d134b0dff714d51de29fa90936f6a8635cf524d90cd"
  },
  "fixture_mode": false,
  "generated": "2026-09-18T14:59:20Z",
  "manifest": {
    "bytes": 3560,
    "name": "manifest",
    "path": "api/rapp-work/manifest.json",
    "sha256": "fd1615ee12d54fd511be2cf5b84a1fbff714fb27fd60d68862a0a7a7f5be3006"
  },
  "schema": "rapp-work-static-api-receipt/1.0"
}
